{
  "feature": "order-migration",
  "status": "saved",
  "started_at": "2026-02-19T14:00:00Z",
  "completed_at": "2026-02-19T14:45:00Z",
  "context_loaded": {
    "plan": {
      "loaded": true,
      "path": ".migration/order-migration/plan/plan.json",
      "migration_goals": {
        "primary": {
          "goal": "decompose-monolith",
          "description": "Break monolithic order management into independently deployable services"
        }
      },
      "scope": {
        "include": {
          "mode": "targeted",
          "paths": [
            "src/main/java/com/company/order",
            "src/main/java/com/company/payment",
            "src/main/java/com/company/inventory",
            "src/main/java/com/company/notification"
          ]
        }
      },
      "focus_areas": ["performance", "data_integrity", "availability"],
      "constraints": {
        "unchanged": ["identity_provider", "external_api_contracts"],
        "integration": {
          "systems": ["Stripe API", "SendGrid", "Twilio", "Identity Provider"]
        }
      }
    },
    "analysis": {
      "loaded": true,
      "path": ".migration/order-migration/analysis/analysis.json",
      "business_rules_count": 15,
      "control_flows_count": 8,
      "entities_count": 12
    },
    "docs": {
      "loaded": true,
      "path": ".migration/docs/index.json"
    }
  },
  "responses": [
    {
      "question_id": "Q1",
      "category": "existing-patterns",
      "question": "Do you have existing architecture patterns or templates to follow?",
      "options_presented": [
        "Yes — I'll provide reference files/links",
        "Follow organizational standards (describe)",
        "No — recommend best practices",
        "Use the same pattern as the current system"
      ],
      "answer": "No — recommend best practices",
      "answered_at": "2026-02-19T14:02:00Z"
    },
    {
      "question_id": "Q2",
      "category": "service-architecture",
      "question": "What architectural style should the target use?",
      "options_presented": [
        "Microservices",
        "Modular monolith",
        "Serverless / FaaS",
        "Event-driven architecture",
        "Keep current architecture (refactor in place)"
      ],
      "answer": "Microservices",
      "answered_at": "2026-02-19T14:05:00Z"
    },
    {
      "question_id": "Q3",
      "category": "service-architecture",
      "question": "How should services/components communicate?",
      "options_presented": [
        "REST (synchronous)",
        "gRPC (synchronous, high-performance)",
        "Message queue / async messaging",
        "Event bus / pub-sub",
        "Mixed (specify per integration)"
      ],
      "answer": ["REST (synchronous)", "Event bus / pub-sub"],
      "answered_at": "2026-02-19T14:08:00Z"
    },
    {
      "question_id": "Q4",
      "category": "data-architecture",
      "question": "What data storage strategy?",
      "options_presented": [
        "Own database per service (database-per-service)",
        "Shared database (existing)",
        "Event sourcing + CQRS",
        "Polyglot persistence",
        "Keep current (unchanged)"
      ],
      "answer": "Own database per service (database-per-service)",
      "answered_at": "2026-02-19T14:11:00Z"
    },
    {
      "question_id": "Q5",
      "category": "data-architecture",
      "question": "Data migration approach?",
      "options_presented": [
        "Big bang migration",
        "Strangler fig (gradual)",
        "Dual-write during transition",
        "Event-driven sync",
        "Not applicable (schema unchanged)"
      ],
      "answer": "Strangler fig (gradual)",
      "answered_at": "2026-02-19T14:14:00Z"
    },
    {
      "question_id": "Q6",
      "category": "security-cross-cutting",
      "question": "Authentication/authorization approach?",
      "options_presented": [
        "Keep current auth (preserve integration)",
        "OAuth 2.0 / OIDC",
        "JWT-based stateless auth",
        "API key / service-to-service auth",
        "mTLS for service mesh"
      ],
      "answer": "OAuth 2.0 / OIDC",
      "answered_at": "2026-02-19T14:17:00Z"
    },
    {
      "question_id": "Q7",
      "category": "security-cross-cutting",
      "question": "What cross-cutting concerns need architectural support?",
      "options_presented": [
        "Logging / observability",
        "Distributed tracing",
        "Circuit breakers / resilience",
        "API gateway / rate limiting",
        "Configuration management",
        "Feature flags"
      ],
      "answer": [
        "Logging / observability",
        "Distributed tracing",
        "Circuit breakers / resilience",
        "API gateway / rate limiting"
      ],
      "answered_at": "2026-02-19T14:20:00Z"
    },
    {
      "question_id": "Q8",
      "category": "deployment-operations",
      "question": "Target deployment model?",
      "options_presented": [
        "Kubernetes / containers",
        "Serverless (AWS Lambda, Azure Functions, etc.)",
        "Traditional VM / bare metal",
        "PaaS (Heroku, App Engine, etc.)",
        "Same as current"
      ],
      "answer": "Kubernetes / containers",
      "answered_at": "2026-02-19T14:23:00Z"
    },
    {
      "question_id": "Q9",
      "category": "deployment-operations",
      "question": "Any additional architectural requirements or preferences?",
      "options_presented": [],
      "answer": "99.9% uptime SLA, max 200ms p95 latency for order creation",
      "answered_at": "2026-02-19T14:25:00Z"
    },
    {
      "question_id": "AQ1",
      "category": "adaptive",
      "question": "Any specific performance targets (latency, throughput)?",
      "options_presented": [],
      "answer": "Order creation < 200ms p95, payment processing < 500ms p95, inventory check < 50ms p95. Support 1000 concurrent orders during peak.",
      "answered_at": "2026-02-19T14:27:00Z"
    },
    {
      "question_id": "AQ2",
      "category": "adaptive",
      "question": "Transaction consistency model?",
      "options_presented": [
        "ACID (strong consistency)",
        "Eventual consistency",
        "Saga pattern",
        "Mixed (per use case)"
      ],
      "answer": "Saga pattern",
      "answered_at": "2026-02-19T14:29:00Z"
    },
    {
      "question_id": "AQ4",
      "category": "adaptive",
      "question": "Should business rules be centralized (rules engine) or embedded in services?",
      "options_presented": [
        "Centralized rules engine",
        "Embedded in owning service",
        "Shared library",
        "Mixed approach"
      ],
      "answer": "Embedded in owning service",
      "answered_at": "2026-02-19T14:31:00Z"
    },
    {
      "question_id": "AQ5",
      "category": "adaptive",
      "question": "Integration layer approach for external systems?",
      "options_presented": [
        "API gateway",
        "Integration bus / ESB",
        "Direct point-to-point",
        "Anti-corruption layer per integration"
      ],
      "answer": "Anti-corruption layer per integration",
      "answered_at": "2026-02-19T14:33:00Z"
    },
    {
      "question_id": "DQ1",
      "category": "diagrams",
      "question": "Would you like diagrams of the target architecture?",
      "options_presented": [
        "Yes — all diagram types (component, sequence, class/entity)",
        "Yes — component diagram only (high-level overview)",
        "Yes — let me pick specific types",
        "No — text document is sufficient"
      ],
      "answer": "Yes — all diagram types (component, sequence, class/entity)",
      "answered_at": "2026-02-19T14:35:00Z"
    },
    {
      "question_id": "RQ1",
      "category": "review",
      "question": "Review the target architecture. What would you like to do?",
      "options_presented": [
        "Approve — save as-is",
        "Needs changes — I'll describe what to adjust",
        "Regenerate section (specify which)",
        "Add more detail to a specific component"
      ],
      "answer": "Approve — save as-is",
      "answered_at": "2026-02-19T14:42:00Z"
    }
  ],
  "decisions": [
    {
      "number": 1,
      "decision": "Organizational architecture patterns",
      "options_considered": ["Reference files", "Org standards", "Best practices", "Keep current"],
      "chosen": "No — recommend best practices",
      "rationale": "No existing architecture standards documented; apply industry best practices",
      "source_question": "Q1"
    },
    {
      "number": 2,
      "decision": "Target architectural style",
      "options_considered": ["Microservices", "Modular monolith", "Serverless", "Event-driven", "Refactor in place"],
      "chosen": "Microservices",
      "rationale": "Independent scaling needs for order vs payment, team autonomy, PCI compliance isolation",
      "source_question": "Q2"
    },
    {
      "number": 3,
      "decision": "Inter-service communication",
      "options_considered": ["REST", "gRPC", "Message queue", "Event bus", "Mixed"],
      "chosen": "REST (synchronous) + Event bus / pub-sub (Kafka)",
      "rationale": "REST for request-response flows requiring immediate results; Kafka for async event propagation",
      "source_question": "Q3"
    },
    {
      "number": 4,
      "decision": "Data storage strategy",
      "options_considered": ["Database-per-service", "Shared database", "Event sourcing + CQRS", "Polyglot", "Keep current"],
      "chosen": "Database-per-service",
      "rationale": "Service independence, PCI compliance boundary, different query patterns per service",
      "source_question": "Q4"
    },
    {
      "number": 5,
      "decision": "Data migration approach",
      "options_considered": ["Big bang", "Strangler fig", "Dual-write", "Event-driven sync"],
      "chosen": "Strangler fig (gradual)",
      "rationale": "Lower risk — migrate one service at a time with validation before proceeding",
      "source_question": "Q5"
    },
    {